{
  "id": "ctrb:fda:2023-11-16:0",
  "type": "Contribution",
  "description": "Indication received accelerated approval.",
  "date": "2023-11-16",
  "contributor": {
    "id": "agent:org:fda",
    "type": "Agent",
    "agentType": "organization",
    "name": "Food and Drug Administration",
    "description": "Regulatory agency that approves drugs for use in the United States."
  }
}