{
  "id": "ctrb:vanallenlab:2025-06-12:0",
  "type": "Contribution",
  "description": "The FDA provided regular approval to taletrectinib for the treatment of patients with ROS1 positive non-small cell lung cancer, accelerated approval to telisotuzumab vedotin-tllv for the treatment of patients with non-squamous non-small cell lung cancer with high c-Met expression, and avutometinib in combination with defactinib (Avmapki Fakzynja co-pack) for the treatment of adult patients with KRAS-mutated recurrent low-grade serous ovarian cancer.",
  "date": "2025-06-12",
  "contributor": {
    "id": "agent:user:vanallenlab",
    "type": "Agent",
    "agentType": "contributor",
    "name": "Van Allen lab",
    "description": "Van Allen lab, Dana-Farber Cancer Institute"
  }
}