{
  "id": "ctrb:vanallenlab:2025-10-20:0",
  "type": "Contribution",
  "description": "EMA approval for quizartinib",
  "date": "2025-10-20",
  "contributor": {
    "id": "agent:user:vanallenlab",
    "type": "Agent",
    "agentType": "contributor",
    "name": "Van Allen lab",
    "description": "Van Allen lab, Dana-Farber Cancer Institute"
  }
}