{
  "id": "ctrb:hse:2014-11-01:0",
  "type": "Contribution",
  "description": "Indication approved for reimbursement.",
  "date": "2014-11-01",
  "contributor": {
    "id": "agent:org:hse",
    "type": "Agent",
    "agentType": "organization",
    "name": "Health Service Executive",
    "description": "Public health service of Ireland, which determines reimbursement of medicines in the public system."
  }
}