{
  "id": "ctrb:ema:2024-02-29:0",
  "type": "Contribution",
  "description": "Indication received approval from the European Commission.",
  "date": "2024-02-29",
  "contributor": {
    "id": "agent:org:ema",
    "type": "Agent",
    "agentType": "organization",
    "name": "European Medicines Agency",
    "description": "Regulatory agency that approves medicines for use in the European Union."
  }
}